{
  "schemaVersion": "1.0.0",
  "reviewId": "review:packet:107:3-4:revision:1:source:source-reviewer-1",
  "packetId": "packet:107:3-4",
  "draftId": "draft:packet:107:3-4:revision:1",
  "revision": 1,
  "scope": {
    "type": "packet",
    "ayahIds": ["ayah:107:3", "ayah:107:4"]
  },
  "reviewerRole": "source",
  "reviewerId": "source-reviewer-1",
  "independent": true,
  "status": "approved",
  "issues": [],
  "reviewedAt": "2026-10-03T20:07:48.805Z"
}
