{
  "schemaVersion": "1.0.0",
  "reviewId": "review:packet:107:3-4:revision:1:pedagogy:pedagogy-reviewer-1",
  "packetId": "packet:107:3-4",
  "draftId": "draft:packet:107:3-4:revision:1",
  "revision": 1,
  "scope": {"type":"packet","ayahIds":["ayah:107:3","ayah:107:4"]},
  "reviewerRole": "pedagogy",
  "reviewerId": "pedagogy-reviewer-1",
  "independent": true,
  "status": "revision-required",
  "issues": [
    {
      "id": "issue:packet:107:3-4:revision:1:pedagogy:001",
      "code": "PHONETIC_ROOT_OVERCLAIM",
      "severity": "error",
      "scopeId": "ayah:107:3",
      "path": "ayahs[0].words[1].layers.teaching.rootPicture",
      "message": "The root picture says that the doubled ض gives حَضَّ a sense of pressing or urging. A shadda marks gemination; it does not by itself supply the lexical meaning or force. This is a misleading learner shortcut.",
      "requiredAction": "Replace the claim with a neutral mnemonic or with the attested lexical gloss, and explain the shadda only as the doubled final radical if that recognition clue is retained.",
      "evidence": {"occurrence":"word:107:3:2","canonicalArabic":"يَحُضُّ","draftText":"The doubled ض gives the root a sense of pressing or urging.","morphology":"The draft itself identifies a geminate root ح ض ض."}
    },
    {
      "id": "issue:packet:107:3-4:revision:1:pedagogy:002",
      "code": "ETYMOLOGICAL_MEMORY_OVERCLAIM",
      "severity": "warning",
      "scopeId": "ayah:107:3",
      "path": "ayahs[0].words[4].layers.learnerConnections[0]",
      "message": "The س ك ن connection is presented as if stillness or restricted movement explains the lexical meaning of مِسْكِين. That can make a speculative memory aid look like a reliable derivation.",
      "requiredAction": "Label any root association explicitly as a mnemonic only, or replace it with the reviewed lexical meaning needy/poor person without implying that inability to move is the word's derivation.",
      "evidence": {"occurrence":"word:107:3:5","canonicalArabic":"ٱلْمِسْكِينِ","draftText":"The root connection س ك ن can suggest being restricted or unable to move freely, a useful memory aid for neediness.","learnerRisk":"A learner may memorize an unsupported etymology instead of the contextual lexical meaning."}
    },
    {
      "id": "issue:packet:107:3-4:revision:1:pedagogy:003",
      "code": "UNEXPLAINED_TECHNICAL_TERM",
      "severity": "warning",
      "scopeId": "ayah:107:3",
      "path": "ayahs[0].ayahLayers.grammar",
      "message": "The ayah-level grammar explanation introduces مُضَافٌ إِلَيْهِ without an English gloss, while the word lessons use iḍāfah plus English explanations. This creates an avoidable terminology jump for learners.",
      "requiredAction": "Gloss the term at first use, for example second term of an iḍāfah/genitive construction, and use the same transliteration and English label in the ayah and word layers.",
      "evidence": {"ayah":"107:3","draftText":"ٱلْمِسْكِينِ is its genitive مُضَافٌ إِلَيْهِ.","relatedTeaching":"The word lesson calls it the second term of an iḍāfah."}
    },
    {
      "id": "issue:packet:107:3-4:revision:1:pedagogy:004",
      "code": "MISLEADING_PROSODY_CUE",
      "severity": "error",
      "scopeId": "ayah:107:4",
      "path": "ayahs[1].words[0].layers.pedagogy.recognitionClue",
      "message": "The recognition clue calls فَ emphatic and instructs the learner to hear a pause after it. فَ is a short consequence connector, not an emphatic consonant, and it does not impose a pause here.",
      "requiredAction": "Replace the cue with a visual/grammatical recognition clue such as identifying فَ as a consequence connector and ٌ as tanwīn ḍammah on وَيْلٌ; do not prescribe a pause after فَ.",
      "evidence": {"occurrence":"word:107:4:1","canonicalArabic":"فَوَيْلٌ","draftText":"Hear the pause after the emphatic فَ and notice the tanwīn at the end of وَيْلٌ.","learnerRisk":"The learner may pronounce فَ as emphatic or insert a pause that is not part of the connector's function."}
    }
  ],
  "reviewedAt": "2026-10-03T20:20:25.331Z"
}
