{
  "schemaVersion": "1.0.0",
  "reviewId": "review:packet:107:5-6:revision:1:source:source-reviewer-1-root2",
  "packetId": "packet:107:5-6",
  "draftId": "draft:107:5-6:revision-001",
  "revision": 1,
  "scope": {
    "type": "packet",
    "ayahIds": [
      "ayah:107:5",
      "ayah:107:6"
    ]
  },
  "reviewerRole": "source",
  "reviewerId": "source-reviewer-1-root2",
  "independent": true,
  "status": "approved",
  "issues": [],
  "reviewedAt": "2026-10-03T12:00:00.000Z"
}
