{
  "schemaVersion": "1.0.0",
  "reviewId": "review:packet:107:1-2:revision:1:morphology:morphology-reviewer-1",
  "packetId": "packet:107:1-2",
  "draftId": "draft:packet:107:1-2:revision:1",
  "revision": 1,
  "scope": {
    "type": "packet",
    "ayahIds": ["ayah:107:1", "ayah:107:2"]
  },
  "reviewerRole": "morphology",
  "reviewerId": "morphology-reviewer-1",
  "independent": true,
  "status": "approved",
  "issues": [],
  "reviewedAt": "2026-10-03T20:23:11.217Z"
}
