{
  "schemaVersion": "1.0.0",
  "reviewId": "review:packet:107:7-7:revision:1:grammar:grammar-reviewer-1",
  "packetId": "packet:107:7-7",
  "draftId": "draft:packet:107:7-7:revision:1",
  "revision": 1,
  "scope": {
    "type": "packet",
    "ayahIds": ["ayah:107:7"]
  },
  "reviewerRole": "grammar",
  "reviewerId": "grammar-reviewer-1",
  "independent": true,
  "status": "approved",
  "issues": [],
  "reviewedAt": "2026-10-03T20:21:04.3435805Z"
}
