{
  "schemaVersion": "1.0.0",
  "reviewId": "review:meaning-reviewer-1:packet:107:5-6:revision:1",
  "packetId": "packet:107:5-6",
  "draftId": "draft:107:5-6:revision-001",
  "revision": 1,
  "scope": {
    "type": "packet",
    "ayahIds": ["ayah:107:5", "ayah:107:6"]
  },
  "reviewerRole": "meaning",
  "reviewerId": "meaning-reviewer-1",
  "independent": true,
  "status": "approved",
  "issues": [],
  "reviewedAt": "2026-10-03T20:20:59.7428484Z"
}
